{
  "$schema": "http://json-schema.org/draft-07/schema#",
  "title": "ContentHubPublishValidationReport",
  "type": "object",
  "required": [
    "version",
    "hubId",
    "articleId",
    "revisionId",
    "environment",
    "status",
    "checkedAt",
    "checks"
  ],
  "additionalProperties": false,
  "properties": {
    "version": { "const": 1 },
    "hubId": { "$ref": "#/definitions/safeId" },
    "articleId": { "$ref": "#/definitions/safeId" },
    "revisionId": { "$ref": "#/definitions/safeId" },
    "environment": { "enum": ["dev", "test", "production"] },
    "status": { "enum": ["pass", "fail", "warning"] },
    "checkedAt": { "$ref": "#/definitions/isoDateTime" },
    "checks": { "type": "array", "minItems": 1, "items": { "$ref": "#/definitions/validationCheck" } }
  },
  "definitions": {
    "safeId": {
      "type": "string",
      "minLength": 1,
      "maxLength": 128,
      "pattern": "^[A-Za-z0-9][A-Za-z0-9._-]*$"
    },
    "isoDateTime": {
      "type": "string",
      "pattern": "^\\d{4}-\\d{2}-\\d{2}T\\d{2}:\\d{2}:\\d{2}(?:\\.\\d{3})?Z$"
    },
    "validationCheck": {
      "type": "object",
      "required": ["code", "severity", "status", "message"],
      "additionalProperties": false,
      "properties": {
        "code": { "$ref": "#/definitions/safeId" },
        "severity": { "enum": ["info", "warning", "error"] },
        "status": { "enum": ["pass", "fail", "warning"] },
        "message": { "type": "string", "minLength": 1, "maxLength": 500 },
        "path": { "type": "string", "minLength": 1, "maxLength": 300 }
      }
    }
  }
}
